title,year,certificate,duration,genre,rating,description,stars,votes,country,show_id,director,type
Curtiz,(2018),TV-MA,98 min,"Biography, Drama, History",6.0,"As America prepares to enter WW2, Hungarian film director Michael Curtiz grapples with political intervention and a dysfunctional relationship with his estranged daughter amid the troubled production of Casablanca in 1942.","['Tamas Yvan Topolanszky', '| ', '    Stars:', 'Ferenc Lengyel, ', 'Evelin Dobos, ', 'Declan Hannigan, ', 'Scott Alexander Young']","1,083",Hungary,s2781,Tamas Yvan Topolanszky,Movie
Sab Jholmaal Hai,(2017– ),TV-G,2 Seasons,Animation,6.7,"The story revolves around the adventures of pets who live in a cozy house, owned by Miss Katkar. When the owner is away, the pets set off on fun and crazy adventures together. While they ...                See full summary »","['Dolly Lopes, ', 'Mubeen Saudagar']",53,India,s912,Vijay Roche,TV Show
Sunrise,(I) (2014),Not Rated,85 min,"Crime, Drama, Mystery",6.3,"Before sunrise, Joshi must catch the elusive figure that destroys the lives of children.","['Partho Sen-Gupta', '| ', '    Stars:', 'Adil Hussain, ', 'Tannishtha Chatterjee, ', 'Gulnaaz Ansari, ', 'Komal Gupta']",300,"India, France",s8121,Partho Sen-Gupta,Movie
Tikli and Laxmi Bomb,(2017),TV-MA,151 min,Drama,7.7,Two sex workers decide to kick men out of the system and form a cooperative that runs the business for women and by women. How do they do things differently? And how far can they get under and overarching and overbearing patriarchy?,"['Aditya Kripalani', '| ', '    Stars:', 'Chitrangada Satarupa, ', 'Vibhawari Deshpande, ', 'Saharsh Kumar Shukla, ', 'Divya Unny']","7,617",India,s8591,Aditya Kripalani,Movie
Puss in Book: Trapped in an Epic Tale,(2017),TV-Y7,23 min,"Animation, Short, Action",5.2,"While out fighting off ninja pirates, Puss stumbles on a fairy tale book. When he opens it, the adventure begins, as the viewer must choose each outcome, eventually freeing Puss from the book.","['Roy Burdine, ', 'Johnny Castuciano', '| ', '    Stars:', 'Eric Bauza, ', 'Jayma Mays, ', 'Maria Bamford, ', 'Jeff Bennett']",592,United States,s5424,"Roy Burdine, Johnny Castuciano",Movie
Jack Whitehall: I'm Only Joking,(2020 TV Special),TV-MA,58 min,Comedy,6.6,"Jack Whitehall hits the stage with hilarious tales about happy couples, life in hotels, human stupidity and his well-traveled father.","['Dave Skinner, ', 'Freddie Waters', '| ', '    Stars:', 'Jack Whitehall, ', 'Michael Whitehall']","1,566",United Kingdom,s2222,"Dave Skinner, Freddie Waters",Movie
"¡Ay, mi madre!",(2019),TV-MA,84 min,Comedy,3.9,A Spanish woman must follow intricate instructions in order to receive a reward.,"['Frank Ariza, ', 'Rafa Montesinos', '| ', '    Stars:', 'Estefanía de los Santos, ', 'Secun de la Rosa, ', 'Terele Pávez, ', 'María Alfonsa Rosso']",412,Spain,s3653,Frank Ariza,Movie
Til Death Do Us Part,(II) (2019),TV-MA,1 Season,"Sci-Fi, Thriller",6.2,"Based on the speculative short stories of MirrorFiction, this sci-fi thriller anthology plunges headlong into our deepest desires -- and darkest fears.","['Kun-Da Wu, ', 'Chen-Ling Wen, ', 'Run-yin Bai, ', 'Yu-Ping Wang']",191,Taiwan,s3591,"Cho Li, Chen Hung-yi, Weica Wang, Liu Bang-yao, Lin Guan-fu, Shen Chi, YC Tom Lee",TV Show
The Wedding Party,(I) (2016),PG-13,112 min,"Comedy, Romance",4.8,A groomsman must navigate a slew of disasters to maintain order at his best friend's wedding reception.,"['Thane Economou', '| ', '    Stars:', 'Michael Adler, ', 'Deniz Akdeniz, ', 'Molly Burnett, ', 'Meg Cionni']",218,Nigeria,s5531,Kemi Adetiba,Movie
ReMastered: The Miami Showband Massacre,(2019 TV Movie),TV-MA,71 min,"Documentary, Crime, Music",7.0,"In 1974, while on the way home from a gig, the apolitical rock group, The Miami Showband, fell into the crosshairs of a Protestant unionist paramilitary group that planted explosives on their bus when it was stopped at a fake checkpoint.","['Stuart Sender', '| ', '    Stars:', 'Stephen Travers, ', 'Bertie Ahern, ', 'Alan Brecknell, ', 'Anne Cadwallader']","1,424",United States,s3984,Stuart Sender,Movie
Room 2806: The Accusation,(2020),TV-MA,197 min,"Documentary, Crime",7.0,This docuseries follows the 2011 sexual assault case involving french politician Dominique Strauss-Kahn at the height of his career.,"['Nafissatou Diallo, ', 'Raphaëlle Bacqué, ', 'Élisabeth Guigou, ', 'Paul Browne']","2,348",France,s1587,Jalil Lespert,TV Show
S Is for Stanley,(2015),TV-MA,78 min,"Documentary, Biography, Drama",6.9,"S Is For Stanley is the story of Emilio D'Alessandro, Stanley Kubrick's personal driver. A Friendship that lasted through 30 years of their lives, helped create four cinema masterpieces, ...                See full summary »","['Alex Infascelli', '| ', '    Stars:', ""Emilio D'Alessandro, "", 'Alex Infascelli, ', 'Roberto Pedicini, ', 'Clive Riche']","1,707",Italy,s7912,Alex Infascelli,Movie
Life Overtakes Me,(2019),TV-PG,39 min,"Documentary, Short",6.5,"In the grip of trauma, hundreds of refugee children in Sweden withdraw from life's uncertainties into a coma-like illness called Resignation Syndrome.","['John Haptas, ', 'Kristine Samuelson', '| ', '    Stars:', 'Henry Ascher, ', 'Nadja Hatem, ', 'Mikael Billing, ', 'Karl Sallin']","1,951","Sweden, United States",s3739,"John Haptas, Kristine Samuelson",Movie
Being Elmo: A Puppeteer's Journey,(2011),PG,80 min,Documentary,7.6,The Muppet Elmo is one of the most beloved characters among children across the globe. Meet the unlikely man behind the puppet - the heart and soul of Elmo - Kevin Clash.,"['Constance Marks, ', 'Philip Shane', '| ', '    Stars:', 'Kevin Clash, ', 'Whoopi Goldberg, ', 'Frank Oz, ', 'Bill Barretta']","7,086",United States,s5942,Constance Marks,Movie
Firebrand,(2019),TV-MA,116 min,Drama,5.1,"The ups and downs of modern-day relationship take the spotlight in this contemporary, slice-of-life story.","['Aruna Raje', '| ', '    Stars:', 'Usha Jadhav, ', 'Girish Kulkarni, ', 'Sachin Khedekar, ', 'Rajeshwari Sachdev']",283,India,s4086,Aruna Raje,Movie
Nikki Glaser: Bangin',(2019 TV Special),TV-MA,63 min,Comedy,6.1,"Nikki Glaser bares all in a blistering stand-up special about sex, sobriety and getting over her own insecurities. And she won't spare you the details.","['Nicholaus Goossen', '| ', '    Star:', 'Nikki Glaser']","1,716",United States,s3472,Nicholaus Goossen,Movie
What Would Sophia Loren Do?,(2021),TV-14,32 min,"Documentary, Short, Biography",6.6,"An Italian-American grandmother and film buff finds strength and joy in the life of her screen idol, Sophia Loren.","['Ross Kauffman', '| ', '    Stars:', 'Nancy Kulik, ', 'Sophia Loren, ', 'Edoardo Ponti']",738,United States,s1412,Ross Kauffman,Movie
SanPa: Sins of the Savior,(2020),TV-MA,298 min,"Documentary, Crime",7.8,"Amidst a heroin crisis, Vincenzo Muccioli cared for the addicted, earning him fierce public devotion -- even as charges of violence began to mount.","['Vincenzo Andreucci, ', 'Antonio Boschini, ', 'Fabio Cantelli, ', 'Walter Delogu']","1,547",Italy,s1480,Cosima Spender,TV Show
Jeff Dunham's Very Special Christmas Special,(2008 TV Special),Not Rated,85 min,Comedy,7.4,The multi-platinum selling comedian performs his first holiday-themed stand-up special with his friends.,"['Michael Simon', '| ', '    Stars:', 'Jeff Dunham, ', 'Brian Haner']","3,049",United States,s4011,Michael Simon,Movie
Kids on the Block,(2019),TV-PG,103 min,"Comedy, Family",5.7,"Children who play constantly with their phones now seem to have forgotten to play on the street. At the insistence of new friends, children decide to play in the park again to end this ...                See full summary »","['Tugçe Soysop', '| ', '    Stars:', 'Selim Bayraktar, ', 'Berat Efe Parlar, ', 'Esat Polat Güler, ', 'Eda Doger']",375,Turkey,s3452,Tugçe Soysop,Movie
Niyazi Gül Dörtnala,(2015),TV-MA,106 min,Comedy,4.5,"Niyazi, a veterinarian, is on the lookout for a special elixir for animals. What he doesn't yet know is a mobster and his estranged love is also on the lookout for that elixir.","['Hakan Algül', '| ', '    Stars:', 'Ata Demirer, ', 'Demet Akbag, ', 'Sebnem Bozoklu, ', 'Levent Ülgen']","3,230",Turkey,s991,Hakan Algül,Movie
Sleepless Society: Insomnia,(2020– ),TV-MA,1 Season,"Drama, Mystery, Thriller",7.4,"Haunted by recurring visions, a young woman with insomnia visits an old home to solve a mystery and put her nightmares to an end.","['Chutimon Chuengcharoensukying, ', 'Warisara Yu, ', 'Nutthasit Kotimanuswanich, ', 'Gee Sutthirak Subvijitra']",90,Thailand,s2924,"Pantham Thongsang, Cheewatan Pusitsuksa",TV Show
The Match,(2019),TV-MA,94 min,Drama,5.0,"The next ninety minutes will change their lives, forever.","['Francesco Carnesecchi', '| ', '    Stars:', 'Francesco Pannofino, ', 'Alberto Di Stasio, ', 'Giorgio Colangeli, ', 'Gabriele Fiore']",684,Italy,s2078,Francesco Carnesecchi,Movie
What We Started,(2017),TV-MA,94 min,Documentary,7.1,"DJs, producers, and promoters discuss the history and state of electronic dance music.","['Bert Marcus, ', 'Cyrus Saidi', '| ', '    Stars:', 'Steve Angello, ', 'Carl Cox, ', 'Chip Eberhart, ', 'Martin Garrix']","2,047",United States,s4802,"Bert Marcus, Cyrus Saidi",Movie
Eric Andre: Legalize Everything,(2020 TV Special),TV-MA,51 min,Comedy,6.2,"Eric Andre takes the stage in New Orleans and tackles flawed fast-food icons, the wonders of autofill and the bizarre choice for the ""Cops"" theme song.","['Eric Notarnicola', '| ', '    Star:', 'Eric André']","2,561",United States,s2346,Eric Notarnicola,Movie
City of Joy,(2016),TV-MA,74 min,"Documentary, Crime, Drama",7.6,"This film follows the first class of students at a remarkable leadership center in the Eastern Democratic Republic of Congo, a region often referred to as ""the worst place in the world to ...                See full summary »","['Madeleine Gavin', '| ', '    Stars:', 'Christine Schuler-Deschryver, ', 'Denis Mukwege Mukengere, ', 'Eve Ensler, ', 'Jane Mukunilwa']",551,"United States,",s4654,Madeleine Gavin,Movie
Hook,(2020– ),TV-MA,45 min,"Drama, Romance, Sport",6.4,"Despite their fathers' rivalry, two university students form a friendship at a boxing gym as they tackle family drama, romance and personal crises.","['Peemapol Panichtamrong, ', 'Phiravich Attachitsataporn, ', 'Jida Jidapa Siribanchawan, ', 'Ninna Yanin Opassathaworn']",27,Thailand,s2276,Rachit Kusonkoonsiri,TV Show
E-Team,(2014),TV-MA,88 min,"Documentary, War",7.1,"When atrocities are committed in countries held hostage by ruthless dictators, Human Rights Watch sends in the E-Team (Emergencies Team), a collection of fiercely intelligent individuals ...                See full summary »","['Katy Chevigny, ', 'Ross Kauffman', '| ', '    Stars:', 'Anna Neistat, ', 'Ole Solvang, ', 'Peter Bouckaert, ', 'Fred Abrahams']",896,United States,s5927,"Katy Chevigny, Ross Kauffman",Movie
Jal,(2013),Unrated,126 min,Drama,6.6,A gifted young man from a drought-stricken village helps a group of ecologists find water for migrating flamingoes.,"['Girish Malik', '| ', '    Stars:', 'Purab Kohli, ', 'Tannishtha Chatterjee, ', 'Kirti Kulhari, ', 'Mukul Dev']",486,India,s7118,Girish Malik,Movie
"Nisman. The Prosecutor, the President and the Spy",(2019–2020),TV-MA,373 min,"Documentary, Crime, History",7.6,"The suspicious death of Alberto Nisman, investigator of the attack on the headquarters of the AMIA in 1994.","['Dexter Filkins, ', 'Hernán Cappiello, ', 'Oscar Parrilli, ', 'José Manuel Ubeira']",597,"Spain, Germany, Denmark, United States",s3068,Justin Webster,TV Show
Seth Rogen's Hilarity for Charity,(2018 TV Special),TV-MA,70 min,Comedy,5.0,Seth Rogen hosts an evening of comedy to raise awareness for Alzheimer's disease.,"['Ryan Polito', '| ', '    Stars:', 'Benji Allonbe, ', 'Ike Barinholtz, ', 'Sacha Baron Cohen, ', 'Lakecia Benjamin']","2,395",United States,s4939,Ryan Polito,Movie
Fortune Feimster: Sweet & Salty,(2020 TV Special),TV-MA,61 min,Comedy,6.8,"Southern-born comedian Fortune Feimster recalls her childhood misadventures as a former Girl Scout, debutante and (disqualified) swim meet champion, and her family's complicated relationship with Hooters.","['Krysia Plonka', '| ', '    Stars:', 'Fortune Feimster, ', 'Henry Gelinas']","1,024",United States,s3004,Krysia Plonka,Movie
Rooting for Roona,(2020),TV-PG,40 min,"Documentary, Short, Drama",7.0,A little girl named Roona Begum is born in the North East of India with an unprecedented head size caused by a birth defect. This is the story of one family and how they raise a child against insurmountable odds.,"['Pavitra Chalam, ', 'Akshay Shankar']",426,India,s1854,"Pavitra Chalam, Akshay Shankar",Movie
Iliza Shlesinger: Unveiled,(2019 TV Special),TV-MA,78 min,Comedy,6.5,"Iliza Shelsinger in her fifth Netflix stand-up special, discussing marriage and its traditions.","['Steve Paley', '| ', '    Stars:', 'Darren Capozzi, ', 'Mona Parks, ', 'Iliza Shlesinger']","1,717",United States,s3257,Steve Paley,Movie
Jimmy Carr: Funny Business,(2016 TV Special),Not Rated,62 min,Comedy,7.2,"A man, with an incredibly stupid laugh, tells jokes to an audience.","['Sam Wrench', '| ', '    Star:', 'Jimmy Carr']","4,433",United Kingdom,s5860,Sam Wrench,Movie
6-5=2,(2014),Unrated,104 min,Horror,4.4,"Six friends decide to undertake a gruelling mountain trek, only to find that the difficulties in store for them are not merely physical. They experience strange and unusual incidents which put their lives at risk.","['Bharat Jain', '| ', '    Stars:', 'Prashantt Guptha, ', 'Gaurav Paswala, ', 'Gaurav Kothari, ', 'Disha Kapoor']",205,India,s6023,Bharat Jain,Movie
Prague,(2013),Not Rated,109 min,"Horror, Mystery, Romance",5.5,"The chaotic ramblings of a young architect's mind take hold of his life as he leaves behind his past in India to work in Prague. In a city of beautiful architecture, a young architect is diverted toward constructions that exist within.","['Ashish R. Shukla', '| ', '    Stars:', 'Chandan Roy Sanyal, ', 'Elena Kazan, ', 'Arfi Lamba, ', 'Kumar Mayank']",373,"India, Switzerland",s7790,Ashish R. Shukla,Movie
Khoon Khoon,(1973),TV-14,127 min,"Crime, Mystery, Thriller",5.2,A Bombay cop tries to track down a serial killer who snipes at random victims.,"['Mohammed Hussain', '| ', '    Stars:', 'Mahendra Sandhu, ', 'Danny Denzongpa, ', 'Jagdeep, ', 'Faryal']",44,India,s5301,Mohammed Hussain,Movie
A Love Song for Latasha,(2019),TV-PG,19 min,"Documentary, Short, Biography",6.8,The injustice surrounding the shooting death of 15-year-old Latasha Harlins at a South Central Los Angeles store became a flashpoint for the city’s 1992 civil uprising.,"['Sophia Nahli Allison', '| ', '    Stars:', ""Tybie O'Bard, "", 'Shinese Harlins, ', 'Zoe Flint, ', 'Nnenna Brown']","2,439",United States,s1963,Sophia Nahli Allison,Movie
Bomb Scared,(2017),TV-MA,89 min,Comedy,5.7,"Four Basque ETA terrorists, living together with peculiar Spanish neighbors, are planning a terrorist attack in Spain, but await instructions from the head of the organization.","['Borja Cobeaga', '| ', '    Stars:', 'Javier Cámara, ', 'Julián López, ', 'Miren Ibarguren, ', 'Gorka Otxoa']","2,894",Spain,s5230,Borja Cobeaga,Movie
Zion,(I) (2018),TV-PG,12 min,"Documentary, Short, Biography",7.1,"A portrait of Zion Clark, a young wrestler who was born without legs and grew up in foster care.","['Floyd Russ', '| ', '    Stars:', 'Zion Clark, ', 'Gilbert Donahue, ', 'Kimberly Clark, ', 'Darese Sparkman']","1,253",United States,s4708,Floyd Russ,Movie
Sebastian Maniscalco: Why Would You Do That?,(2016 TV Special),TV-14,63 min,Comedy,7.4,"Filmed at the legendary Beacon Theatre, Sebastian Maniscalco continues to deliver his signature comedy style that blends high-energy physical acts-outs and hilariously demonstrative facial expressions.","['Joe DeMaio', '| ', '    Star:', 'Sebastian Maniscalco']","1,127",United States,s3623,Joe DeMaio,Movie
Potato Potahto,(2017),TV-MA,115 min,Comedy,4.2,A divorced couple who decide to share equal space in their ex-matrimonial home soon realize that the ingenious idea is easier said than done.,"['Shirley Frimpong-Manso', '| ', '    Stars:', 'O.C. Ukeje, ', 'Joselyn Dumas, ', 'Joke Silva, ', 'Kemi Lala Akindoju']",213,Ghana,s3145,Shirley Frimpong-Manso,Movie
Donald Glover: Weirdo,(2012 TV Special),Not Rated,65 min,Comedy,7.4,"With his unique brand of youthful storytelling Donald Glover brings down the house in his hysterical stand-up special, Weirdo.","['Shannon Hartman', '| ', '    Star:', 'Donald Glover']","3,629",United States,s5713,"Shannon Hartman, Michelle Caputo",Movie
Hating Peter Tatchell,(2021),TV-MA,91 min,Documentary,7.6,"The profound life story of the controversial human rights campaigner whose provocative acts of civil disobedience rocked the establishment, revolutionised attitudes to homosexuality and exposed tyrants in the fight for equality.","['Christopher Amos', '| ', '    Stars:', 'Ian McKellen, ', 'Stephen Fry, ', 'George Carey, ', 'Peter Tatchell']",804,Australia,s861,Christopher Amos,Movie
Horrid Henry's Gross Day Out,(2020),TV-Y,61 min,"Animation, Action, Adventure",5.8,Henry isn't well and goes out.,"['Gary Andrews', '| ', '    Stars:', 'Sue Elliott-Nichols, ', 'Tamsin Heatley, ', 'Emma Tate, ', 'Lizzie Waterworth']",45,United Kingdom,s1986,Gary Andrews,Movie
Mutiny of the Worker Bees,(2020),TV-MA,93 min,Comedy,4.1,"Omar Buendía, a super smart guy, who came out with the best average in school and is expected to do great things in life.","['Carlos Morett', '| ', '    Stars:', 'Gustavo Egelhaaf, ', 'Alejandro Suárez, ', 'Bárbara de Regil, ', 'Mauricio Argüelles']",484,Mexico,s2499,Carlos Morett,Movie
Heroes Wanted,(2016),TV-MA,95 min,"Action, Comedy",4.6,Agents from diverse Spanish local police forces are called to form a special team.,"['Joaquín Mazón', '| ', '    Stars:', 'María León, ', 'Miki Esparbé, ', 'Jordi Sánchez, ', 'Andoni Agirregomezkorta']","2,005",Spain,s5620,Joaquín Mazón,Movie
ReMastered: Who Shot the Sheriff?,(2018 TV Movie),TV-14,57 min,"Documentary, Biography, Crime",6.9,The violent political suppression of the roots reggae movement in Jamaica told through an investigation into Jamaican politics and the CIA's involvement in the mysterious shooting of Bob Marley.,"['Kief Davidson', '| ', '    Stars:', 'Bob Marley, ', 'Arnold Bertram, ', 'Cindy Breakspeare, ', 'Nancy Burke']","1,461",United States,s4517,Kief Davidson,Movie
Spirit Riding Free: Ride Along Adventure,(2020 TV Short),TV-Y7,22 min,"Animation, Short, Action",6.0,"Join Lucky and her friends on a mission to save Maricela's beloved mare, Mystery, from greedy horse thieves who've taken her captive with a wild herd.","['Allan Jacobsen, ', 'Beth Sleven, ', 'Kevin Wotton, ', 'Stephen Cooper, ', 'Josh Taback', '| ', '    Stars:', 'Amber Frank, ', 'Bailey Gambertoglio, ', 'Sydney Park, ', 'Bella Aboulhosn']",64,United States,s1581,"Beth Sleven, Allan Jacobsen, Kevin Wotton",Movie
Jeff Dunham: Minding the Monsters,(2012 TV Special),TV-MA,80 min,Comedy,7.0,"Jeff Dunham's ""Minding the Monsters"" brings together Walter, Peanut, Bubba J, Jose Jalapeno, and Achmed the Dead Terrorist as you've never seen them before! The result is an all-new original live comedy event that is so funny, it's scary!","['Manny Rodriguez, ', 'Matthew McNeil', '| ', '    Star:', 'Jeff Dunham']","1,425",United States,s4010,Manny Rodriguez,Movie
Kathleen Madigan: Bothering Jesus,(2016 Video),TV-MA,72 min,Comedy,7.4,"Once again Kathleen's standup is beyond hysterical where she riffs on drinking, Jesus, her large and funny family, Ireland, Missouri ( Her home state) and her views on life!","['Lorene Machado', '| ', '    Star:', 'Kathleen Madigan']",551,United States,s5722,Lorene Machado,Movie
Hajwala: The Missing Engine,(2016),PG-13,96 min,"Action, Adventure, Crime",2.0,"Khalid and Kehailan are two team leaders who are passionate about car racing and challenges. They enter into a crazy competition to win the challenge involving a lot of surprises, which unexpectedly change both their lives.","['Ali Bin Matar, ', 'Ibrahim Bin Mohamed, ', 'Hasan Aljaberi', '| ', '    Stars:', 'Anwar Aljabri, ', 'Haleem Aljabri, ', 'Omar Aljabri, ', 'Abdullah Bin Haider']",261,United Arab Emirates,s5189,"Ali Bin Matar, Ibrahim Bin Mohamed",Movie
The Redeemed and the Dominant: Fittest on Earth,(2016),Unrated,104 min,"Documentary, Sport",7.1,"The fittest athletes on earth take on the CrossFit Games, the ultimate test of fitness to prove that they are the fittest on earth.","['Heber Cannon, ', 'Marston Sawyers, ', 'Ian Wittenber', '| ', '    Stars:', 'Dan Bailey, ', 'Samantha Briggs, ', 'Dave Castro, ', 'Katrin Tanja Davidsdottir']","1,599",United States,s8480,"Heber Cannon, Mariah Moore, Marston Sawyers",Movie
Illegal Woman,(2020),TV-MA,119 min,Drama,6.2,The life of an immigration lawyer changes radically when his new client appears dead in suspicious circumstances inside a CIE (immigration detention center).,"['Ramon Térmens', '| ', '    Stars:', 'Daniel Faraldo, ', 'Isak Férriz, ', 'Yolanda Sey, ', 'Montse Germán']",206,Spain,s900,Ramon Térmens,Movie
French Dirty,(2015),TV-MA,72 min,"Comedy, Drama",5.0,"The distant past, the recent past and the present collide in French Dirty, a meditation on love, loss and growing up as a millennial.","['Jesse Allain-Marcus, ', 'Wade Allain-Marcus', '| ', '    Stars:', 'Wade Allain-Marcus, ', 'Melina Lizette, ', 'Arjun Gupta, ', 'Elsa Biedermann']",281,United States,s6802,"Wade Allain-Marcus, Jesse Allain-Marcus",Movie
Q Ball,(2019),TV-MA,96 min,"Documentary, Sport",6.8,"Documentary that explores the San Quentin Prison basketball squad - teammates and inmates at ""the Q"" - along their journey of rehabilitation and possible redemption.","['Michael Tolajian', '| ', '    Stars:', 'Obada Adnan, ', 'Anthony Ammons, ', 'Lenny Costa, ', 'Rafael Cuevas']",647,United States,s7808,Michael Tolajian,Movie
Print the Legend,(2014),TV-14,100 min,"Documentary, Biography, Drama",7.0,"Follows the people racing to bring the hot new 3D printing technology to your home, documenting the ""Macintosh Moment"" of this revolution and exploring what it takes to live the American Dream.","['Luis Lopez, ', 'Clay Tweel', '| ', '    Stars:', 'Chris Anderson, ', 'Bruce Bradshaw, ', 'Craig Broady, ', 'Bill Buel']","1,990",United States,s5930,"Luis Lopez, Clay Tweel",Movie
Kingdom of Us,(2017),TV-MA,109 min,"Documentary, Drama",6.9,A father's suicide sends a family of eight on a journey through childhood memories and treacherous emotional waters in this poignant documentary.,"['Lucy Cohen', '| ', '    Stars:', 'Jamie-Jodie Shanks, ', 'Kacie-Kimie Shanks, ', 'Lorie-Lanie Shanks, ', 'Mirie-Marie Shanks']",912,United Kingdom,s5226,Lucy Cohen,Movie
Garbage,(2012),Not Rated,88 min,"Comedy, Drama",5.2,"Two garbage truck drivers in Hollywood become celebrities overnight after they find Cuba Gooding Jr.'s Best Supporting Actor Oscar for ""Jerry Maguire"" and suddenly their lives go topsy-turvy.","['Phil Volken', '| ', '    Stars:', 'Jed Rees, ', 'Jon Huck, ', 'Alanna Ubach, ', 'Daryl Hannah']",619,India,s4667,Qaushiq Mukherjee,Movie
Hans Zimmer Live in Prague,(2017 TV Special),TV-G,150 min,"Documentary, Music",9.1,The renowned film score composer leads a concert featuring his cinematic compositions.,"['Tim Van Someren', '| ', '    Stars:', 'Hans Zimmer, ', 'Yolanda Charles, ', 'Michael Einziger, ', 'Nick Glennie-Smith']","2,710",United Kingdom,s6919,Tim Van Someren,Movie
Mike Birbiglia: The New One,(2019 TV Special),TV-MA,85 min,Comedy,7.7,Comedian Mike Birbiglia hits Broadway with a hilarious yet profound one-man show that recounts his emotional and physical journey to parenthood.,"['Seth Barrish', '| ', '    Star:', 'Mike Birbiglia']","1,863",United States,s3229,Seth Barrish,Movie
Mater,(I) (2017),TV-MA,80 min,Drama,4.6,"Mater is a film about the struggle between love and law; about social differences and distances that these generate. And about love, that crosses all, allows all: both good and evil.","[""Pablo D'Alo Abba"", '| ', '    Stars:', 'Lautaro Perotti, ', 'Tamara Kiper, ', 'Inda Lavalle, ', 'Araceli Dvoskin']",249,Argentina,s7422,Pablo D'Alo Abba,Movie
Still,(2010),TV-MA,100 min,"Horror, Thriller",4.3,"An omnibus film of four stories pulled straight from Thailand's most gruesome headlines. In ""Flame"", a man is haunted by regret and a ghost after he survives a nightclub fire that killed ...                See full summary »","['Poj Arnon, ', 'Chatchai Katenut, ', 'Tanwarin Sukkhapisit, ', 'Manussa Vorasingha', '| ', '    Stars:', 'Mai Charoenpura, ', 'Akara Amarttayakul, ', 'Supakson Chaimongkol, ', 'TAE']",368,Thailand,s8092,"Chatchai Katenut, Manussa Vorasingha, Tanwarin Sukkhapisit, Poj Arnon",Movie
Jim Jefferies: This Is Me Now,(2018 TV Special),TV-MA,70 min,Comedy,7.4,"The gleefully irreverent Jefferies skewers ""grabby"" celebrities, political hypocrisy and his own ill-advised career moves in a brash stand-up special.","['Scott Zabielski', '| ', '    Star:', 'Jim Jefferies']","4,095",United States,s4775,Scott Zabielski,Movie
The CEO,(I) (2016),PG-13,105 min,"Drama, Mystery, Thriller",5.7,"Five top-level staff of a company are selected for a retreat where the new CEO of a global company will be chosen. What starts off as cordial soon goes sour as they attempt to outdo one another to be named ""The CEO.""","['Kunle Afolayan', '| ', '    Stars:', 'Angélique Kidjo, ', 'Wale Ojo, ', 'Jimmy Jean-Louis, ', 'Hilda Dokubo']",122,Nigeria,s8242,Kunle Afolayan,Movie
Rise of the Zombie,(2013),Not Rated,86 min,"Drama, Horror, Thriller",3.3,"A heartbroken wildlife photographer throws himself into his work, only to find himself experiencing strange transformations.","['Luke Kenny, ', 'Devaki Singh', '| ', '    Stars:', 'Luke Kenny, ', 'Kirti Kulhari, ', 'Ashwin Mushran, ', 'Benjamin Gilani']",444,India,s7872,"Devaki Singh, Luke Kenny",Movie
