title,year,certificate,duration,genre,rating,description,stars,votes,country,show_id,director,type
Har Kisse Ke Hisse: Kaamyaab,(2018),TV-14,109 min,Drama,7.8,"Sudheer is an actor from the heyday of Bollywood. Years after his retirement, he realizes that he 'retired' on the verge of accomplishing a unique record. He decides to come out of his retirement to complete the round figure of 500.","['Hardik Mehta', '| ', '    Stars:', 'Sanjay Mishra, ', 'Deepak Dobriyal, ', 'Sarika Singh, ', 'Isha Talwar']","4,253",India,s519,Hardik Mehta,Movie
Black Beach,(2020),TV-MA,110 min,Drama,5.6,Carlos is a businessman who gets a request to intercede on behalf of a US engineer in the oil industry who's been kidnapped.,"['Esteban Crespo', '| ', '    Stars:', 'Raúl Arévalo, ', 'Paulina García, ', 'Candela Peña, ', 'Claude Musungayi']","1,615","Spain, Belgium, United States",s1348,Esteban Crespo,Movie
Becoming,(II) (2020),PG,89 min,"Documentary, Biography",6.9,"Join former first lady Michelle Obama in an intimate documentary looking at her life, hopes and connection with others during her 2019 book tour for 'Becoming.'","['Nadia Hallgren', '| ', '    Stars:', 'Elizabeth Alexander, ', 'Adrian K. Collins, ', 'Valerie Jarrett, ', 'Gayle King']","6,391",United States,s2560,Nadia Hallgren,Movie
Maktub,(2017),TV-MA,100 min,"Comedy, Drama",7.3,"The biggest Israeli blockbuster since 1986 . Steve and Chuma , two criminals are the sole survivors of a terrorist attack at a restaurant in Jerusalem. They decide to change their ways and ...                See full summary »","['Oded Raz', '| ', '    Stars:', 'Guy Amir, ', 'Hanan Savyon, ', 'Gal Amitai, ', 'Chen Amsalem']","2,764",Israel,s4827,Oded Raz,Movie
Maria,(II) (2019),TV-MA,90 min,"Action, Crime, Drama",5.0,A Filipino female assassin quits and fakes her death. Her old boss finds out after she's gotten a family. He tries to kill them. She responds.,"['Pedring Lopez', '| ', '    Stars:', 'Cristine Reyes, ', 'Germaine De Leon, ', 'KC Montero, ', 'Ronnie Lazaro']","2,196",Philippines,s3814,Pedring A. Lopez,Movie
Bill Burr: Paper Tiger,(2019 TV Special),TV-MA,67 min,Comedy,8.1,"Bill Burr unloads on outrage culture, male feminism, cultural appropriation, robot sex and more in a blistering stand-up special shot in London.","['Mike Binder', '| ', '    Star:', 'Bill Burr']","11,373","United States, United Kingdom",s3529,Mike Binder,Movie
About Time,(2018),R,70 min,Fantasy,6.9,"Our heroine will have the unfortunate ability to see the ""life clocks"" of everyone around her, including herself, and the hero will somehow be able to stop her ""time"" without lifting a ...                See full summary »","['Kim Ro Woon, ', 'Lee Song-Kyoung, ', 'Kim Hae-sook, ', 'Na Young-hee']",614,United Kingdom,s3909,Richard Curtis,Movie
James Acaster: Repertoire,(2018),TV-MA,205 min,Comedy,8.4,James Acaster presents four interwoven stand-up comedy specials.,"['James Acaster, ', 'Joe Parham, ', 'Stuart Laws, ', 'Nathaniel Metcalfe']","3,826",United Kingdom,s4969,Dan Lucchesi,TV Show
Nazi Concentration Camps,(1945),Not Rated,59 min,"Documentary, History",8.3,Produced and presented as evidence at the Nuremberg war crimes trial of Hermann Göring and twenty other Nazi leaders.,"['George Stevens', '| ', '    Stars:', 'Dwight D. Eisenhower, ', 'Omar N. Bradley, ', 'George S. Patton, ', 'Hayden Sears']","1,481",United States,s7576,George Stevens,Movie
Christmas Crossfire,(2020),TV-MA,105 min,"Comedy, Crime, Thriller",4.8,"A man foils an attempted murder, then flees the crew of would-be killers along with their intended target as a woman he's just met tries to find him.","['Detlev Buck', '| ', '    Stars:', 'Kostja Ullmann, ', 'Alli Neumann, ', 'Sascha Alexander Gersak, ', 'Sophia Thomalla']","1,404",Germany,s1593,Detlev Buck,Movie
Jerry Seinfeld: 23 Hours to Kill,(2020 TV Special),TV-PG,60 min,Comedy,6.7,"Comedian Jerry Seinfeld performs at the Beacon Theatre in New York City with his take on everyday life, uncovering comedy in the commonplace.","['Joe DeMaio, ', 'Steven Rimdzius', '| ', '    Star:', 'Jerry Seinfeld']","5,180",United States,s2562,Joe DeMaio,Movie
Chasing Coral,(2017),TV-PG,93 min,Documentary,8.0,"Coral reefs around the world are vanishing at an unprecedented rate. A team of divers, photographers and scientists set out on a thrilling ocean adventure to discover why and to reveal the underwater mystery to the world.","['Jeff Orlowski-Yang', '| ', '    Stars:', 'Andrew Ackerman, ', 'Pim Bongaerts, ', 'Neal Cantin, ', 'Phil Dustan']","5,250",United States,s5377,Jeff Orlowski,Movie
Sabrina,(2018),TV-MA,113 min,"Horror, Thriller",4.1,A toy manufacturer and his wife are terrorized by a demon after their orphaned niece tries to call her late mother's spirit.,"['Rocky Soraya', '| ', '    Stars:', 'Luna Maya, ', 'Christian Sugiono, ', 'Sara Wijayanto, ', 'Jeremy Thomas']","1,785",Indonesia,s4375,Rocky Soraya,Movie
Riding Faith,(2020),TV-G,81 min,Family,4.4,"With the impending foreclose of the family Ranch, Rebecca struggles with her rebellious daughter Grace who is still not over the death of her father Mike.","['Paco Aguilar', '| ', '    Stars:', 'Grace Van Dien, ', 'John Schneider, ', 'T.C. Stallings, ', 'Marisa Brown']",238,United States,s2381,Paco Aguilar,Movie
F.R.E.D.I.,(2018),TV-PG,90 min,"Adventure, Family, Sci-Fi",5.0,James needs a topic for his science project at high school or he'll fail his class. He finds an AI robot in the woods near home.,"['Sean Olson', '| ', '    Stars:', 'Kelly Hu, ', 'Angus Macfadyen, ', 'Candace Cameron Bure, ', 'Lucius Hoyos']","1,042",United States,s4296,Sean Olson,Movie
Into the Beat,(2020),TV-14,102 min,"Drama, Music, Romance",5.3,A ballerina discovers hip-hop by chance and is faced with an impossible choice: Does she pursue her family's legacy or her newfound love.,"['Stefan Westerwelle', '| ', '    Stars:', 'Alexandra Pfeifer, ', 'Helen Schneider, ', 'Anton Wichers, ', 'Trystan Pütter']","1,382",Germany,s1032,Stefan Westerwelle,Movie
Mandela,(2021),TV-14,140 min,"Comedy, Drama",8.4,A local barber's fate turns overnight when he becomes the single deciding vote in the village elections.,"['Madonne Ashwin', '| ', '    Stars:', 'Yogi Babu, ', 'Sheela Rajkumar, ', 'Sangili Murugan, ', 'Mukesh']","7,055",India,s1099,Madonne Ashwin,Movie
You Are My Home,(2020),TV-PG,92 min,"Animation, Family, Fantasy",6.6,"This drama follows the relationship of a heartbroken woman and a young immigrant girl who has lost her mother at the border, coming together just before Christmas.","['Amanda Raymond', '| ', '    Stars:', 'Alyssa Milano, ', 'Cristián de la Fuente, ', 'Angel Parker, ', 'Eva Ariel Binder']",548,United States,s1598,Amanda Raymond,Movie
Loev,(2015),TV-MA,92 min,"Drama, Romance",5.9,"A weekend trip between friends takes a sudden turn, making them each question what love is and what it means to them.","['Sudhanshu Saria', '| ', '    Stars:', 'Dhruv Ganesh, ', 'Siddharth Menon, ', 'Shiv Panditt, ', 'Dixit']","2,752",India,s5506,Sudhanshu Saria,Movie
Strong Island,(2017),TV-MA,107 min,"Documentary, Crime",6.4,"When filmmaker Yance Ford investigates the 1992 murder of a young Black man, it becomes an achingly personal journey since the victim, 24-year-old William Ford Jr., was the filmmaker's brother.","['Yance Ford', '| ', '    Stars:', 'Yance Ford, ', 'Harvey Walker, ', 'Kevin Myers, ', 'Lauren Ford']","3,936","United States, Denmark",s5272,Yance Ford,Movie
Carnaval,(2021),TV-MA,94 min,Comedy,4.0,"After a breakup, an influencer takes her friends on a free trip to Bahia's vibrant Carnival, where she learns life's not just about social media likes.","['Leandro Neri', '| ', '    Stars:', 'Alexandre Moreira, ', 'Antônio Rafaski, ', 'Bruna Inocencio, ', 'Diogo Baleeiro']",930,Brazil,s784,Leandro Neri,Movie
Cuba and the Cameraman,(2017),TV-14,113 min,Documentary,8.2,"Life in Cuba for three struggling families over the course of 45 years, from the cautious optimism of the early 1970s to the harrowing 1990s after the fall of the Soviet Union and the 2016 death of Fidel Castro.",['Jon Alpert'],"4,943",United States,s5153,Jon Alpert,Movie
Habibie & Ainun,(2012),TV-14,120 min,"Biography, Drama, Romance",7.6,"This movie is based on the memoir written by the 3rd President of Indonesia and one of the world-famous engineer, B.J. Habibie about his wife, Hasri Ainun Habibie.","['Faozan Rizal', '| ', '    Stars:', 'Reza Rahadian, ', 'Bunga Citra Lestari, ', 'Tio Pakusadewo, ', 'Ratna Riantiarno']","2,144","Indonesia, Singapore",s4158,Faozan Rizal,Movie
Bottom of the World,(2017),Not Rated,85 min,"Drama, Mystery, Thriller",5.1,"The mysterious disappearance of a young woman leads her boyfriend on a journey for truth and perhaps his own unknown reality in this dark, hypnotic mystery that transcends the limitations of traditional narrative.","['Richard Sears', '| ', '    Stars:', 'Jena Malone, ', 'Douglas Smith, ', 'Ted Levine, ', 'Tamara Duarte']","5,262","Canada, United States",s6366,Richard Sears,Movie
Torbaaz,(2020),TV-MA,133 min,"Action, Drama, Sport",6.8,"A man rises from personal tragedy to lead a group of children from a refugee camp to victory, transforming their lives through the game of cricket.","['Girish Malik', '| ', '    Stars:', 'Sanjay Dutt, ', 'Nargis Fakhri, ', 'Rahul Dev, ', 'Kuwaarjeet Chopraa']","17,926",India,s1562,Girish Malik,Movie
Sahara,(2017),TV-Y7,86 min,"Animation, Adventure, Comedy",5.5,A young cobra and his scorpion best friend go on a journey across the Sahara desert to save a new-found love.,"['Pierre Coré', '| ', '    Stars:', 'Omar Sy, ', 'Louane Emera, ', 'Franck Gastambide, ', 'Vincent Lacoste']","2,841","France, Canada",s5492,Pierre Coré,Movie
4L,(2019),TV-MA,105 min,"Comedy, Drama",5.9,"Tocho, Jean Pierre and Ely travel from Spain to Mali to meet Ely's dying father for the last time.","['Gerardo Olivares', '| ', '    Stars:', 'Jean Reno, ', 'Hovik Keuchkerian, ', 'Susana Abaitua, ', 'Juan Dos Santos']","3,305",Spain,s3669,Gerardo Olivares,Movie
Beneath the Leaves,(2019),TV-MA,90 min,Thriller,4.5,"Four small-town boys are kidnapped by James Whitley, a warm-eyed psychopath.","['Adam Marino', '| ', '    Stars:', 'Mira Sorvino, ', 'Kristoffer Polaha, ', 'Doug Jones, ', 'Aaron Farb']","1,538",United States,s6283,Adam Marino,Movie
Burning Sands,(2017),TV-MA,96 min,Drama,6.0,"Deep into Hell Week, a favored pledgee is torn between honoring his code of silence or standing up against the intensifying violence of underground hazing.","['Gerard McMurray', '| ', '    Stars:', 'Trevor Jackson, ', 'Tosin Cole, ', 'DeRon Horton, ', 'Alfre Woodard']","2,886",United States,s5580,Gerard McMurray,Movie
Deep,(2021),TV-MA,101 min,"Drama, Mystery, Sci-Fi",4.8,Four insomniac med school students are lured into a neuroscience experiment that spirals out of control and must find a way out before it's too late.,"['Sita Likitvanichkul, ', 'Jetarin Ratanaserikiat, ', 'Apirak Samudkidpisan, ', 'Thanabodee Uawithya, ', 'Adirek Wattaleela', '| ', '    Stars:', 'Panisara Rikulsurakan, ', 'Kay Lertsittichai, ', 'Supanaree Sutavijitvong, ', 'Krit Jeerapattananuwong']","1,483",Thailand,s440,"Sita Likitvanichkul, Jetarin Ratanaserikiat, Apirak Samudkitpaisan, Thanabodee Uawithya, Adirek Wattaleela",Movie
The Speed Cubers,(2020),TV-PG,39 min,"Documentary, Short, Sport",7.4,Discover the special bond -- and uncommon competitive spirit -- shared by the world's Rubik's Cube-solving record breakers in this documentary.,"['Sue Kim', '| ', '    Stars:', 'Max Park, ', 'Schwan Park, ', 'Philipp Weyer, ', 'Feliks Zemdegs']","3,575",United States,s2200,Sue Kim,Movie
Silencer,(2018),Not Rated,88 min,"Drama, Thriller",3.8,"Disgraced alcoholic veteran must reawaken all his deadly skills, and track down his former employer when he fails to complete his last hit.","['Timothy Woodward Jr.', '| ', '    Stars:', 'Johnny Messner, ', 'Tito Ortiz, ', 'Chuck Liddell, ', 'Danny Trejo']","1,142",United States,s8018,Timothy Woodward Jr.,Movie
Layla M.,(2016),TV-MA,98 min,Drama,6.6,A teenage Muslim growing up in Amsterdam becomes radicalised.,"['Mijke de Jong', '| ', '    Stars:', 'Nora El Koussour, ', 'Ilias Addab, ', 'Hassan Akkouch, ', 'Yasemin Cetinkaya']","1,749","Netherlands, Belgium, Germany, Jordan",s4972,Mijke de Jong,Movie
Made in China,(II) (2019),TV-MA,128 min,"Comedy, Drama",6.3,"Story of Failed Gujarati Businessman, who jumps into unknown world of China to get once in a life time business idea, which will change his life.","['Mikhil Musale', '| ', '    Stars:', 'Rajkummar Rao, ', 'Boman Irani, ', 'Mouni Roy, ', 'Paresh Rawal']","4,478",India,s3033,Mikhil Musale,Movie
Garbage,(I) (2018),TV-MA,105 min,"Drama, Thriller",3.7,The lives of a fundamentalist online troll and a woman reeling from a sex tape gone viral become dangerously intertwined in this provocative thriller.,"['Qaushiq Mukherjee', '| ', '    Stars:', 'Tanmay Dhanania, ', 'Trimala Adhikari, ', 'Satarupa Das, ', 'Gitanjali Dang']","1,029",India,s4667,Qaushiq Mukherjee,Movie
Dragons: Rescue Riders: Secrets of the Songwing,(2020 TV Movie),TV-Y,46 min,"Animation, Action, Adventure",5.1,"When a musical dragon with a beautiful voice hypnotizes the dragons and people of Huttsgalor, the Rescue Riders have to find a way to break the spell.","['Greg Rankin, ', 'T.J. Sullivan', '| ', '    Stars:', 'Noah Kaye Bentley, ', 'Brennley Brown, ', 'Zach Callison, ', 'Nicolas Cantu']",187,United States,s2209,"Greg Rankin, TJ Sullivan",Movie
And Breathe Normally,(2018),TV-14,95 min,Drama,6.9,"Two women's lives will intersect while trapped in circumstances unforeseen. Between a struggling Icelandic mother and an asylum seeker from Guinea-Bissau, a delicate bond will form as both strategize to get their lives back on track.","['Isold Uggadottir', '| ', '    Stars:', 'Kristín Þóra Haraldsdóttir, ', 'Babetida Sadjo, ', 'Patrik Nökkvi Pétursson, ', 'Kolbeinn Arnbjörnsson']","3,122","Iceland, Sweden, Belgium",s4213,Ísold Uggadóttir,Movie
Biggie: I Got a Story to Tell,(2021),R,97 min,"Documentary, Biography, Music",6.8,"This documentary features rare footage filmed by Christopher Wallace's best friend, Damion ""D-Roc"" Butler, and interviews with his closest friends and family, revealing a side of Biggie Smalls that the world never knew.","['Emmett Malloy', '| ', '    Stars:', 'The Notorious B.I.G., ', 'Damion Butler, ', ""Sean 'Diddy' Combs, "", 'Voletta Wallace']","5,115",United States,s1249,Emmett Malloy,Movie
Sankofa,(1993),TV-MA,125 min,Drama,7.0,A self-absorbed Black American fashion model on a photo shoot in Africa is spiritually transported back to a plantation in the West Indies where she experiences first-hand the physical and ...                See full summary »,"['Haile Gerima', '| ', '    Stars:', 'Kofi Ghanaba, ', 'Oyafunmike Ogunlano, ', 'Alexandra Duah, ', 'Nick Medley']",710,"United States, Ghana, Burkina Faso, United Kingdom, Germany, Ethiopia",s8,Haile Gerima,Movie
Be Here Now,(2015),TV-MA,100 min,"Documentary, Biography, Drama",8.5,"As though life is imitating art, actor and sex-symbol, Andy Whitfield, had just become a star as the lead in the hit television series,'Spartacus,' when he is faced with his biggest ...                See full summary »","['Lilibet Foster', '| ', '    Stars:', 'Jai Courtney, ', 'Andy Whitfield, ', 'Indigo Whitfield, ', 'Jesse Whitfield']","3,417","United States, Australia",s6257,Lilibet Foster,Movie
Kill Ratio,(2016),TV-MA,86 min,Action,4.0,An attack on the new President of a fledgling Eastern European democracy pits an American covert operative against the country's ruthless military leader determined to seize control of the government.,"['Paul Tanter', '| ', '    Stars:', 'Tom Hopper, ', 'Amy Huberman, ', 'Nick Dunning, ', 'Michelle Lehane']",958,United States,s7202,Paul Tanter,Movie
Treasures from the Wreck of the Unbelievable,(2017),TV-G,90 min,Documentary,6.0,"The fake story of the art found beneath the depths of the ocean from a 2,000 year old ship wreck. Damien Hirst and the crew recount the moments various discoveries are made, the myths and legends surrounding the find.","['Sam Hobkinson', '| ', '    Stars:', 'Damien Hirst, ', 'Piotr Baumann, ', 'Andrew Whipp']","1,482",United Kingdom,s8620,Sam Hobkinson,Movie
The House Next Door,(2017),Not Rated,137 min,Horror,6.7,"A young married couple begin to encounter several paranormal attacks, when a family moves into a neighbouring house, that is being haunted by a vengeful spirit, which leads them to perform an exorcism in order to help save the neighbours.","['Milind Rau', '| ', '    Stars:', 'Prakash Belawadi, ', 'Khushi Hajare, ', 'Andrea Jeremiah, ', 'Atul Kulkarni']","2,463",India,s5089,Milind Rau,Movie
Chopsticks,(2019),TV-MA,100 min,"Comedy, Drama",6.5,A gifted but insecure woman is in for a transformative experience when she enlists an enigmatic con to help recover her stolen car from a Mumbai thug.,"['Sachin Yardi', '| ', '    Stars:', 'Abhay Deol, ', 'Mithila Palkar, ', 'Vijay Raaz, ', 'Achint Kaur']","4,800",India,s3789,Sachin Yardi,Movie
One Night Stand,(I) (2016),TV-MA,97 min,"Drama, Romance",3.1,The story is about Urvil Raisingh and Celina who meet at an event and a memorable night later. Returning back home they continue with their lives. The memories of Celina haunt Urvil. What happens next forms the crux of the unfolding drama. One Night Stand explores the hypocritical world we live in. What is it that Urvil wants?,"[""Jasmine D'Souza"", '| ', '    Stars:', 'Tanuj Virwani, ', 'Sunny Leone, ', 'Narendra Jetley, ', 'Aamir Ahmed']","1,315",India,s7666,Jasmine D'Souza,Movie
Dragon Quest: Your Story,(2019),TV-PG,103 min,"Animation, Action, Adventure",6.5,Based on the fifth Dragon Quest game.,"['Takashi Yamazaki', '| ', '    Stars:', 'Kasumi Arimura, ', 'Steve Blum, ', 'Shaun Conde, ', 'Jacob Craner']","2,871",Japan,s2920,"Takashi Yamazaki, Ryuichi Yagi, Makoto Hanafusa",Movie
Funny Boy,(2020),TV-MA,109 min,Drama,6.5,"Explores Arjie's sexual awakening from a young boy to a teenager who falls in love with a male classmate, just as political tensions escalate between the Sinhalese and Tamils in the years leading up to the 1983 uprisings.","['Deepa Mehta', '| ', '    Stars:', 'Agam Darshi, ', 'Nimmi Harasgama, ', 'Seema Biswas, ', 'Ali Kazmi']",923,"Canada, United States",s1564,Deepa Mehta,Movie
Our Lovers,(2016),TV-MA,88 min,"Comedy, Drama, Romance",6.7,"One man, one woman, one rule: not fall in love.","['Miguel Ángel Lamata', '| ', '    Stars:', 'Eduardo Noriega, ', 'Michelle Jenner, ', 'Fele Martínez, ', 'Amaia Salamanca']","4,274",Spain,s5533,Miguel Ángel Lamata,Movie
The Plagues of Breslau,(2018),TV-MA,110 min,"Action, Crime, Mystery",5.9,Every day at 6 pm a serial killer kills a different person. Police officer Helena Rus decides to find the killer by researching about 18th century history of the city.,"['Patryk Vega', '| ', '    Stars:', 'Malgorzata Kozuchowska, ', 'Daria Widawska, ', 'Katarzyna Bujakiewicz, ', 'Andrzej Grabowski']","5,084",Poland,s2654,Patryk Vega,Movie
Bad Day for the Cut,(2017),Not Rated,99 min,"Action, Crime, Drama",6.5,"A middle-aged Irish farmer, who still lives at home with his mother, sets off on a mission of revenge when his mother is murdered.","['Chris Baugh', '| ', '    Stars:', ""Nigel O'Neill, "", 'Susan Lynch, ', 'Józef Pawlowski, ', 'Stuart Graham']","8,260",United Kingdom,s5075,Chris Baugh,Movie
Morris from America,(2016),R,91 min,"Comedy, Drama, Romance",6.3,The romantic and coming-of-age misadventures of a 13-year-old American living in Germany.,"['Chad Hartigan', '| ', '    Stars:', 'Markees Christmas, ', 'Craig Robinson, ', 'Carla Juri, ', 'Patrick Güldenberg']","5,379","Germany, United States",s7511,Chad Hartigan,Movie
Notes for My Son,(2020),TV-MA,84 min,Drama,6.4,A woman with terminal cancer decides to keep a notebook full of musings on life and love for her toddler son to read after she dies.,"['Carlos Sorin', '| ', '    Stars:', 'Valeria Bertuccelli, ', 'Esteban Lamothe, ', 'Julian Sorin, ', 'Mauricio Dayub']",943,Argentina,s1658,Carlos Sorín,Movie
Black Snow,(2017),TV-MA,90 min,"Crime, Drama, Mystery",6.2,"Accused of killing his brother during adolescence, Salvador lives alone in the middle of Patagonia. Several decades later, his brother Marcos and his sister-in-law Laura, come to convince him to sell the lands they share by inheritance.","['Martín Hodara', '| ', '    Stars:', 'Ricardo Darín, ', 'Leonardo Sbaraglia, ', 'Laia Costa, ', 'Federico Luppi']","5,796","Argentina, Spain",s6329,Martin Hodara,Movie
Dead Kids,(2019),TV-MA,98 min,Thriller,5.4,A socially awkward teen bonds with a group of misfits who plot to abduct the schools arrogant rich kid until their kidnapping scheme turns deadly.,"['Mikhail Red', '| ', '    Stars:', 'Kelvin Miranda, ', 'Vance Larena, ', 'Khalil Ramos, ', 'Jan Silverio']",585,"Philippines, United States",s3192,Mikhail Red,Movie
Struggle: The Life and Lost Art of Szukalski,(2018),TV-MA,115 min,"Documentary, Biography",7.9,"This documentary chronicles the life of Polish-American artist Stanislav Szukalski (1893-1987) from his early years in Chicago, to his time in Poland and Los Angeles, and his artistic and political contributions to the world.","['Ireneusz Dobrowolski', '| ', '    Stars:', 'Stanislav Szukalski, ', 'Glenn Bray, ', 'Robert Williams, ', 'Suzanne Williams']","4,272","Poland, United States",s4276,Irek Dobrowolski,Movie
The Women and the Murderer,(2021),TV-14,92 min,"Documentary, Crime",6.4,"Two brave women, a police chief and a victim's mother, make tireless efforts to find and prosecute serial killer Guy Georges, in 1990s Paris.","['Mona Achache, ', 'Patricia Tourancheau', '| ', '    Stars:', 'Anne Gautier, ', 'Hélène Frinking, ', 'Agnès Nijkamp, ', 'Martine Monteil']","1,324",France,s92,"Mona Achache, Patricia Tourancheau",Movie
Monster Hunter: Legends of the Guild,(2021 TV Movie),TV-14,58 min,"Animation, Action, Adventure",5.1,"In a world where humans and fearsome monsters live in an uneasy balance, young hunter Aiden fights to save his village from destruction by a dragon.","['Steve Yamamoto', '| ', '    Stars:', 'Dante Basco, ', 'Erica Lindbeck, ', 'Brando Eaton, ', 'Karen Strassman']","1,312","United States, Japan",s280,Steven Yamamoto,Movie
Dave Chappelle,(2017),TV-MA,66 min,"Documentary, Comedy",8.7,"Comedian Dave Chappelle makes his triumphant return to the screen with a pair of blistering, never-before-aired specials from his personal vault.",['Dave Chappelle'],"2,851",United States,s5563,Stan Lathan,TV Show
Taylor Tomlinson: Quarter-Life Crisis,(2020 TV Special),TV-14,61 min,Comedy,7.4,"She's halfway through her 20s, and she's over it. Too old to party, too young to settle down, comedian Taylor Tomlinson takes aim at her life choices.","['Marcus Raboy', '| ', '    Star:', 'Taylor Tomlinson']","3,960",United States,s2850,Marcus Raboy,Movie
Bon Cop Bad Cop 2,(2017),Not Rated,126 min,"Action, Comedy, Crime",6.6,A francophone S.Q. officer and an anglophone O.P.P officer reunite to investigate a large car theft ring led by an Italian mobster.,"['Alain Desrochers', '| ', '    Stars:', 'Colm Feore, ', 'Patrick Huard, ', 'Marc Beaupré, ', 'Noam Jenkins']","4,194",Canada,s5173,Alain Desrochers,Movie
Yucatán,(I) (2018),TV-MA,129 min,"Adventure, Comedy, Romance",5.5,"Two white collar thieves compete fiercely against the other trying to steal millions from an old baker, that he won in the lotto.","['Daniel Monzón', '| ', '    Stars:', 'Luis Tosar, ', 'Rodrigo de la Serna, ', 'Joan Pera, ', 'Stephanie Cayo']","2,175",Spain,s4114,Daniel Monzón,Movie
Shadow,(2019),TV-MA,45 min,"Action, Crime, Drama",6.5,"In Johannesburg, tough ex-cop Shadow pursues justice on his own terms and seeks to help those who are powerless to protect themselves.","['Pallance Dladla, ', 'Khathu Ramabulana, ', 'Amanda Du-Pont, ', 'Tumie Ngumla']",979,"China, Hong Kong",s3303,Zhang Yimou,Movie
Goedam,(2020– ),TV-MA,10 min,"Short, Horror, Mystery",5.7,"When night falls on the city, shadows and spirits come alive in this horror anthology series centered on urban legends.","['Song Chae-Yoon, ', 'Han Su-ah, ', 'Shim So-Young, ', 'Seola']",995,South Korea,s2109,Hong Won-ki,TV Show
Fierce,(2020),TV-MA,118 min,"Comedy, Music",5.5,"Talent and passion for music can take one to the very top. On the way, however, there are going to be showbiz traps.","['Anna Wieczur-Bluszcz', '| ', '    Stars:', 'Julia Kaminska, ', 'Tomasz Karolak, ', 'Adrian Majewski, ', 'Maria Pakulnis']","1,266",Poland,s1607,Anna Wieczur-Bluszcz,Movie
The Gospel of John,(2014),Unrated,160 min,Drama,7.7,"The life and toils of Jesus Christ, depicted as written in the gospel of John. Narrated in English, following the New International Version of the scripture, while the actors speak in Aramaic.","['David Batty', '| ', '    Stars:', 'David Harewood, ', 'Selva Rasalingam, ', 'Mourad Zaoui, ', ""El Mahmoudi M'Barek""]",928,"United Kingdom, United States, Morocco",s8327,David Batty,Movie
The Man Without Gravity,(2019),TV-14,107 min,"Comedy, Drama, Fantasy",5.8,"Oscar comes to light on a stormy night, in the hospital of a small town and immediately we understand that there is something extraordinary in him : Does not obey the law of gravity. It ...                See full summary »","['Marco Bonfanti', '| ', '    Stars:', 'Elio Germano, ', 'Michela Cescon, ', 'Elena Cotta, ', ""Silvia D'Amico""]","2,572","Italy, Belgium",s3349,Marco Bonfanti,Movie
Tragic Jungle,(2020),TV-MA,96 min,"Adventure, Drama, Mystery",5.6,"To escape an arranged marriage, a woman flees into the depths of the Mayan jungle, where untamed nature merges the human and the supernatural.","['Yulene Olaizola', '| ', '    Stars:', 'Indira Rubie Andrewin, ', 'Gilberto Barraza, ', 'Mariano Tun Xool, ', 'Eligio Meléndez']",971,"Mexico, France, Colombia",s751,Yulene Olaizola,Movie
