title,year,certificate,duration,genre,rating,description,stars,votes,country,show_id,director,type
Nothing to Hide,(2018),TV-MA,90 min,"Comedy, Drama",6.8,"3.5 couples meet for dinner party. The men have known each other for decades. During dinner they play a game of sharing texts, calls, e-mails etc. by placing all 7 cell phones on the table. Unexpected results as all have secrets.","['Fred Cavayé', '| ', '    Stars:', 'Bérénice Bejo, ', 'Suzanne Clément, ', 'Stéphane De Groodt, ', 'Vincent Elbaz']","15,405","France, Belgium",s4384,Fred Cavayé,Movie
Tell Me Who I Am,(2019),TV-MA,86 min,"Documentary, Drama, Mystery",7.6,"After losing his memory in an accident, Alex Lewis trusts his twin brother, Marcus, to tell him about his past only to discover that he's hiding a dark secret about their childhood.","['Ed Perkins', '| ', '    Stars:', 'Andrew Caley, ', 'Alex Lewis, ', 'Marcus Lewis, ', 'Evan Milton']","14,794",United Kingdom,s3409,Ed Perkins,Movie
Next Gen,(I) (2018),TV-PG,106 min,"Animation, Action, Adventure",6.6,"A friendship with a top-secret robot turns a lonely girl's life into a thrilling adventure as they take on bullies, evil bots and a scheming madman.","['Kevin R. Adams, ', 'Joe Ksander, ', 'Ricardo Curtis', '| ', '    Stars:', 'John Krasinski, ', 'Charlyne Yi, ', 'Jason Sudeikis, ', 'Michael Peña']","17,664","China, Canada, United States",s4657,"Kevin R. Adams, Joe Ksander",Movie
The Angel,(2018),TV-MA,114 min,"Action, Biography, Drama",6.6,"As his country prepares for war, top Egyptian official Ashraf Marwan makes contact with Israel and wades into a shadowy game of high-stakes espionage.","['Ariel Vromen', '| ', '    Stars:', 'Toby Kebbell, ', 'Marwan Kenzari, ', 'Hannah Ware, ', 'Waleed Zuaiter']","14,291","Israel, United States",s4642,Ariel Vromen,Movie
The Stranger,(1946),Passed,95 min,"Crime, Drama, Film-Noir",7.3,An investigator from the War Crimes Commission travels to Connecticut to find an infamous Nazi.,"['Orson Welles', '| ', '    Stars:', 'Orson Welles, ', 'Edward G. Robinson, ', 'Loretta Young, ', 'Philip Merivale']","26,705",United States,s608,Bryan Bertino,Movie
Happy as Lazzaro,(2018),PG-13,128 min,"Drama, Fantasy, Mystery",7.5,An unceasingly kind Italian peasant and his family are blatantly exploited by a tobacco baroness.,"['Alice Rohrwacher', '| ', '    Stars:', 'Adriano Tardiolo, ', 'Agnese Graziani, ', 'Alba Rohrwacher, ', 'Luca Chikovani']","18,327","Italy, Switzerland, France, Germany",s4356,Alice Rohrwacher,Movie
American Factory,(2019),TV-14,110 min,Documentary,7.4,"In post-industrial Ohio, a Chinese billionaire opens a factory in an abandoned General Motors plant, hiring two thousand Americans. Early days of hope and optimism give way to setbacks as high-tech China clashes with working-class America.","['Steven Bognar, ', 'Julia Reichert', '| ', '    Stars:', ""Junming 'Jimmy' Wang, "", 'Robert Allen, ', 'Sherrod Brown, ', 'Dave Burrows']","21,972",United States,s3568,"Steven Bognar, Julia Reichert",Movie
Your Name Engraved Herein,(2020),Not Rated,118 min,"Drama, Romance",7.2,"In 1987, as martial law ends in Taiwan, Jia-han and Birdy fall in love amid family pressure, homophobia and social stigma.","['Kuang-Hui Liu', '| ', '    Stars:', 'Edward Chen, ', 'Jing-Hua Tseng, ', 'Leon Dai, ', 'Shih-Sian Wang']","6,194",Taiwan,s1501,Liu Kuang-hui,Movie
A Babysitter's Guide to Monster Hunting,(2020),TV-PG,98 min,"Comedy, Family, Fantasy",5.4,A babysitter embarks on a mission to save a child who's been abducted by monsters.,"['Rachel Talalay', '| ', '    Stars:', 'Tamara Smart, ', 'Oona Laurence, ', 'Tom Felton, ', 'Troy Leigh-Anne Johnson']","4,238",United States,s1845,Rachel Talalay,Movie
The Bling Ring,(2022),TV-MA,65 min,"Documentary, Crime, History",5.6,"Based on the ""Bling Ring"" robberies that took place in LA rich suburbs between 2008-2009. Three-part documentary with access to the gang that perpetuated the heist.","['Cabot Rea, ', 'Tim Cullingworth-Hudson, ', 'Audrina Patridge, ', 'Perez Hilton']",226,"United States, United Kingdom, France, Germany, Japan",s3009,Sofia Coppola,Movie
Blue Jay,(I) (2016),Unrated,80 min,"Drama, Romance",7.2,"Meeting by chance when they return to their tiny California hometown, two former high-school sweethearts reflect on their shared past.","['Alex Lehmann', '| ', '    Stars:', 'Mark Duplass, ', 'Sarah Paulson, ', 'Clu Gulager, ', 'James Andrews']","17,735",United States,s5688,Alex Lehmann,Movie
Acts of Violence,(2018),R,86 min,"Action, Crime, Thriller",5.3,"At a bachelorette party in a nightclub, the bride tells 2 guys offering blow to go away. They abduct her. The groom's 2 big brothers looked after their kid brother as kids and do so now again as veterans, ""looking"" for her and the 2 guys.","['Brett Donowho', '| ', '    Stars:', 'Bruce Willis, ', 'Cole Hauser, ', 'Shawn Ashmore, ', 'Ashton Holmes']","12,447",Canada,s6089,Brett Donowho,Movie
A 2nd Chance,(2011),PG,90 min,"Adventure, Drama, Family",4.7,A young girl and her coach overcome adversity to make their way into the National Australian Gymnastics Squad.,"['Clay Glen', '| ', '    Stars:', 'Nina Pearce, ', 'Adam Tuominen, ', 'Emily Morris, ', 'Amy Handley']","1,051",Australia,s5390,Clay Glen,Movie
Mirai,(2018),PG,98 min,"Animation, Adventure, Drama",7.0,"A young boy encounters a magical garden which enables him to travel through time and meet his relatives from different eras, with guidance by his younger sister from the future.","['Mamoru Hosoda', '| ', '    Stars:', 'Rebecca Hall, ', 'Daniel Dae Kim, ', 'John Cho, ', 'Crispin Freeman']","15,916","Japan, United States",s2452,Mamoru Hosoda,Movie
The Ruthless,(2019),TV-MA,111 min,"Crime, Drama",6.2,A rebellious teenager grows up to become one of Milan's most ambitious criminals during the golden years of the 'ndrangheta' Mafia in the 1980s.,"['Renato De Maria', '| ', '    Stars:', 'Riccardo Scamarcio, ', 'Sara Serraiocco, ', 'Alessio Praticò, ', 'Alessandro Tedeschi']","6,331","Italy, France",s3905,Renato De Maria,Movie
ARQ,(2016),TV-MA,88 min,"Action, Sci-Fi, Thriller",6.3,"Trapped in a lab and stuck in a time loop, a disoriented couple fends off masked raiders while harboring a new energy source that could save humanity.","['Tony Elliott', '| ', '    Stars:', 'Robbie Amell, ', 'Rachael Taylor, ', 'Shaun Benson, ', 'Gray Powell']","39,434","Canada, United States",s5793,Tony Elliott,Movie
Tune in for Love,(2019),TV-MA,122 min,"Drama, Romance",7.1,"In 1994 during the IMF crisis, two people meet while exchanging stories on a radio program. They fall in love, but can't quite seem to get the timing right.","['Ji-woo Jung', '| ', '    Stars:', 'Kim Go-eun, ', 'Jung Hae-In, ', 'Park Hae-joon, ', 'Kim Guk-Hee']","4,315",South Korea,s3309,Jung Ji-woo,Movie
Raat Akeli Hai,(2020),TV-MA,149 min,"Crime, Drama, Mystery",7.2,The film follows a small town cop who is summoned to investigate the death of a politician which gets complicated by the victim's secretive family and his own conflicted heart.,"['Honey Trehan', '| ', '    Stars:', 'Ashish Chhipa, ', 'Nawazuddin Siddiqui, ', 'Radhika Apte, ', 'Aditya Srivastav']","18,239",India,s2187,Honey Trehan,Movie
Vampires vs. the Bronx,(2020),PG-13,85 min,"Comedy, Horror",5.7,A group of young friends from the Bronx fight to save their neighborhood from gentrification...and vampires.,"['Oz Rodriguez', '| ', '    Stars:', 'Jaden Michael, ', 'Gerald Jones III, ', 'Gregory Diaz IV, ', 'Sarah Gadon']","10,046",United States,s1901,Oz Rodriguez,Movie
A California Christmas,(2020),PG-13,106 min,"Comedy, Drama, Romance",5.8,"With his carefree lifestyle on the line, a wealthy charmer poses as a ranch hand to get a hardworking farmer to sell her family's land before Christmas.","['Shaun Paul Piccinino', '| ', '    Stars:', 'Lauren Swickard, ', 'Josh Swickard, ', 'Ali Afshar, ', 'David Del Rio']","9,930",United States,s1551,Shaun Paul Piccinino,Movie
Mascots,(2016),TV-MA,89 min,Comedy,5.8,A look into the world of competitive mascots.,"['Christopher Guest', '| ', '    Stars:', 'Zach Woods, ', 'Wayne Wilderson, ', 'Sarah Baker, ', 'Michael Hitchcock']","7,499",United States,s5756,Christopher Guest,Movie
The Hater,(2020),TV-MA,135 min,"Drama, Thriller",7.1,A young man searches for purpose in a net of hatred and violence that he tries to control.,"['Jan Komasa', '| ', '    Stars:', 'Maciej Musialowski, ', 'Vanessa Aleksander, ', 'Danuta Stenka, ', 'Jacek Koman']","15,306",Poland,s2199,Jan Komasa,Movie
Voyeur,(II) (2017),TV-MA,95 min,"Documentary, Crime",6.1,"Journalism icon Gay Talese reports on Gerald Foos, the owner of a Colorado motel, who allegedly secretly watched his guests with the aid of specially designed ceiling vents, peering down from an ""observation platform"" he built in the motel's attic.","['Myles Kane, ', 'Josh Koury', '| ', '    Stars:', 'Gay Talese, ', 'Gerald Foos, ', 'Nan Talese, ', 'Susan Morrison']","6,266",United States,s5149,"Myles Kane, Josh Koury",Movie
Hot Girls Wanted: Turned On,(2017),TV-MA,280 min,Documentary,6.6,"Personal stories reveal how the intersection of sex, technology and intimate relationships is rewiring us in fundamental ways.","['James Rhine, ', 'Lauren Phillips, ', 'Akira Lane, ', 'Riley Reynolds']","2,240",United States,s5522,"Jill Bauer, Ronna Gradus, Rashida Jones",TV Show
Trailer Park Boys: The Animated Series,(2019–2020),TV-MA,25 min,"Animation, Comedy",7.5,"Nova Scotia's favorite miscreants have always been super sketchy. Now, carrying on from the Season 12 finale, the boys have become complete cartoons.","['John Paul Tremblay, ', 'Robb Wells, ', 'Mike Smith, ', 'Patrick Roach']","3,061",Canada,s2481,"Norm Hiscock, Gary Howsam, Mike Smith, John Paul Tremblay, Robb Wells",TV Show
The Mire,(2018– ),TV-MA,50 min,"Crime, Drama, Thriller",7.0,"In an early-'80s Polish town, a prostitute and a youth leader are found killed, but the police's handling of the case makes two journalists suspicious.","['Dawid Ogrodnik, ', 'Zofia Wichlacz, ', 'Andrzej Seweryn, ', 'Agnieszka Zulewska']","4,460",Poland,s504,Jan Holoubek,TV Show
Ugly,(2013),Not Rated,128 min,"Crime, Drama, Mystery",8.0,The case of a missing girl takes us through a journey of human greed and brushes upon the egos and repressed emotions of the characters.,"['Anurag Kashyap', '| ', '    Stars:', 'Rahul Bhat, ', 'Ronit Roy, ', 'Tejaswini Kolhapure, ', 'Vineet Kumar Singh']","22,068",India,s8653,Anurag Kashyap,Movie
Gnome Alone,(2017),PG,85 min,"Animation, Adventure, Comedy",5.6,"When Chloe discovers that her new home's garden gnomes are not what they seem, she must decide between the pursuit of a desired high school life and taking up the fight against the Troggs.","['Peter Lepeniotis', '| ', '    Stars:', 'Becky G, ', 'Josh Peck, ', 'Tara Strong, ', 'Olivia Holt']","3,596","United Kingdom, Canada, United States, Cayman Islands",s4493,Peter Lepeniotis,Movie
I'm No Longer Here,(2019),TV-MA,112 min,Drama,7.3,"In Monterrey, Mexico, a young street gang spends their days dancing to slowed-down cumbia and attending parties. After a mix-up with a local cartel, their leader is forced to migrate to the U.S. but quickly longs to return home.","['Fernando Frias', '| ', '    Stars:', 'Juan Daniel García Treviño, ', 'Xueming Angelina Chen, ', 'Emily May Jampel, ', 'Leo Zapata']","8,099","Mexico, United States",s2468,Fernando Frías de la Parra,Movie
Stree,(2018),Not Rated,128 min,"Comedy, Horror",7.5,"In the small town of Chanderi, the menfolk live in fear of an evil spirit named ""Stree"" who abducts men in the night. Based on the urban legend of ""Nale Ba"" that went viral in Karnataka in the 1990s.","['Amar Kaushik', '| ', '    Stars:', 'Ashish Chhipa, ', 'Rajkummar Rao, ', 'Shraddha Kapoor, ', 'Pankaj Tripathi']","33,919",India,s3769,Amar Kaushik,Movie
Middle School: The Worst Years of My Life,(2016),PG,92 min,"Animation, Comedy, Family",6.0,"After his principal (Andy Daly) destroys his sketchbook, Rafe (Griffin Gluck) and his best friend Leo (Thomas Barbusca) decide to ""destroy his book"" and break every rule in the school's Code of Conduct.","['Steve Carr', '| ', '    Stars:', 'Griffin Gluck, ', 'Lauren Graham, ', 'Alexa Nisenson, ', 'Andy Daly']","9,209","United States, Cambodia",s7453,Steve Carr,Movie
Zapped,(2014 TV Movie),TV-G,102 min,"Comedy, Family, Fantasy",5.0,"When Zoey's mom remarries, Zoey finds it hard adjusting to her new life - no longer the only kid in the family.","['Peter DeLuise', '| ', '    Stars:', 'Zendaya, ', 'Chanelle Peloso, ', 'Spencer Boldman, ', 'Emilia McCarthy']","5,519","Canada, United States",s5622,Peter DeLuise,Movie
Toc Toc,(2017),TV-MA,90 min,Comedy,6.8,The adventures and misadventures of a group of patients with OCD appointed at the same time.,"['Vicente Villanueva', '| ', '    Stars:', 'Paco León, ', 'Alexandra Jiménez, ', 'Rossy de Palma, ', 'Nuria Herrero']","19,253",Spain,s4903,Vicente Villanueva,Movie
Mr. Roosevelt,(2017),R,90 min,Comedy,6.2,"After a loved one falls ill, 25 year old struggling comedian Emily Martin returns to her college town of Austin, Texas and must come to terms with her past while staying with her ex-boyfriend and his new girlfriend.","['Noël Wells', '| ', '    Stars:', 'Noël Wells, ', 'Nick Thune, ', 'Britt Lower, ', 'Daniella Pineda']","3,437",United States,s5108,Noël Wells,Movie
The Invisible Guardian,(2017),TV-MA,129 min,"Crime, Thriller",6.4,A female inspector confronts a serial killer while dealing with the ghosts of her past.,"['Fernando González Molina', '| ', '    Stars:', 'Marta Etura, ', 'Elvira Mínguez, ', 'Nene, ', 'Francesc Orella']","16,086","Spain, Germany",s5347,Fernando González Molina,Movie
Sweet Virginia,(2017),R,93 min,"Action, Drama, Thriller",6.2,A former rodeo champ befriends a young man with a propensity for violence.,"['Jamie M. Dagg', '| ', '    Stars:', 'Jon Bernthal, ', 'Christopher Abbott, ', 'Imogen Poots, ', 'Rosemarie DeWitt']","10,866","United States, Canada",s8140,Jamie M. Dagg,Movie
Edge of Fear,(2018),Not Rated,91 min,"Action, Crime, Thriller",4.5,"After being stabbed in the heart by ruthless home invaders, a man is left for dead. Now weak, outnumbered, and knife sticking from his chest, he attempts to do the impossible: save his wife from these murderers before he bleeds to death.","['Bobby Roth', '| ', '    Stars:', 'Rockmond Dunbar, ', 'Zhu Zhu, ', 'Shen Lin, ', 'Robert Knepper']","3,257",United States,s4435,Bobby Roth,Movie
"My Teacher, My Obsession",(2018 TV Movie),TV-14,90 min,"Drama, Thriller",4.4,"Riley struggles to meet friends after transferring to a new high school where her father is an English teacher. When she meets Kyla, a fellow loner, they become close friends until Riley learns that Kyla is obsessed with her father.","['Damián Romay', '| ', '    Stars:', 'Rusty Joiner, ', 'Lucy Loken, ', 'Laura Bilgeri, ', 'Jana Lee Hamblin']","2,407",United States,s1310,Damián Romay,Movie
Sextuplets,(2019),TV-14,97 min,Comedy,4.4,Father-to-be Alan is shocked to learn that he was born a sextuplet. He and his newfound brother Russell set out on a hilarious journey to reunite with their other long-lost siblings.,"['Michael Tiddes', '| ', '    Stars:', 'Marlon Wayans, ', 'Bresha Webb, ', 'Michael Ian Black, ', 'Glynn Turman']","8,687",United States,s3584,Michael Tiddes,Movie
David Attenborough: A Life on Our Planet,(2020),PG,83 min,"Documentary, Biography",8.9,One man has seen more of the natural world than any other. This unique feature documentary is his witness statement.,"['Alastair Fothergill, ', 'Jonathan Hughes, ', 'Keith Scholey', '| ', '    Stars:', 'David Attenborough, ', 'Max Hughes']","32,001","United States, United Kingdom",s1887,"Alastair Fothergill, Jonnie Hughes, Keith Scholey",Movie
Red Dot,(2021),TV-MA,86 min,"Drama, Horror, Thriller",5.5,"When Nadja becomes pregnant, she and David make an attempt to rekindle their relationship by traveling to the north of Sweden for a hiking trip, but soon their romantic trip turns into a nightmare.","['Alain Darborg', '| ', '    Stars:', 'Nanna Blondell, ', 'Anastasios Soulis, ', 'Thomas Hanzon, ', 'Johannes Kuhnke']","13,476",Sweden,s1326,Alain Darborg,Movie
Wheelman,(2017),TV-MA,82 min,"Action, Crime, Thriller",6.4,A getaway driver for a bank robbery realizes he has been double crossed and races to find out who betrayed him.,"['Jeremy Rush', '| ', '    Stars:', 'Frank Grillo, ', 'Caitlin Carmichael, ', 'Garret Dillahunt, ', 'Shea Whigham']","20,704",United States,s5212,Jeremy Rush,Movie
Benji,(I) (2018),TV-PG,87 min,"Crime, Drama, Family",6.3,"Two school kids strike up a friendship with an orphaned puppy named Benji. When danger befalls them and they end up kidnapped by robbers who are in over their heads, Benji and his scruffy sidekick come to the rescue.","['Brandon Camp', '| ', '    Stars:', 'Gabriel Bateman, ', 'Darby Camp, ', 'Kiele Sanchez, ', 'Gralen Bryant Banks']","4,861","United Arab Emirates, United States",s4978,Brandon Camp,Movie
Nobody Sleeps in the Woods Tonight 2,(2021),TV-MA,96 min,"Comedy, Horror, Thriller",3.9,"When something horrible happens to the only survivor of a bloody massacre, an insecure rookie cop must overcome his fears to stop further carnage.","['Bartosz M. Kowalski', '| ', '    Stars:', 'Mateusz Wieclawek, ', 'Julia Wieniawa-Narkiewicz, ', 'Zofia Wichlacz, ', 'Andrzej Grabowski']","3,814",Poland,s1789,Bartosz M. Kowalski,Movie
A Fortunate Man,(2018),TV-14,162 min,"Drama, Romance",7.2,"A gifted engineer flees his austere roots to pursue wealth and success among Copenhagen's elite, but the pride propelling him threatens to be his ruin.","['Bille August', '| ', '    Stars:', 'Esben Smed, ', 'Katrine Greis-Rosenthal, ', 'Benjamin Kitter, ', 'Julie Christiansen']","6,337",Denmark,s3895,Bille August,Movie
Jungle Beat: The Movie,(2020),G,88 min,"Animation, Adventure, Comedy",5.4,A homesick alien crash-lands his spaceship near the colorful African Jungle. His new animal friends need to get him back to his ship and teach him about friendship and fun before his Space-Conqueror father can take over the planet.,"['Brent Dawes', '| ', '    Stars:', 'David Menkin, ', 'David Rintoul, ', 'Gavin Peter, ', 'Florrie Wilkinson']","1,058",Mauritius,s883,Brent Dawes,Movie
The Trap,(III) (2019),TV-MA,90 min,Comedy,4.3,A man returns home to Atlanta to help his brother's struggling restaurant.,"['Erik White', '| ', '    Stars:', 'T.I., ', 'Mike Epps, ', 'Loretta Devine, ', 'Brian J. Pitt']","1,701",United States,s3958,Erik White,Movie
The Devil Inside,(2012),R,83 min,Horror,4.2,"In Italy, a woman becomes involved in a series of unauthorized exorcisms during her mission to discover what happened to her mother, who allegedly murdered three people during her own exorcism.","['William Brent Bell', '| ', '    Stars:', 'Fernanda Andrade, ', 'Simon Quarterman, ', 'Evan Helmuth, ', 'Ionut Grama']","36,124",United States,s8277,William Brent Bell,Movie
Paddleton,(2019),TV-MA,89 min,"Comedy, Drama",7.1,An unlikely friendship between two misfit neighbors becomes an unexpectedly emotional journey when the younger man is diagnosed with terminal cancer.,"['Alex Lehmann', '| ', '    Stars:', 'Christine Woods, ', 'Mark Duplass, ', 'Ray Romano, ', 'Jen Kuo Sung']","13,991",United States,s4087,Alex Lehmann,Movie
Headshot,(II) (2016),Not Rated,118 min,"Action, Drama, Thriller",6.3,"Uwais plays a young man who washes ashore, an amnesiac with a serious head injury whose past comes back to haunt him shortly after being nursed back to health by a young doctor. Violence ensues. Sweet, sweet violence.","['Kimo Stamboel, ', 'Timo Tjahjanto', '| ', '    Stars:', 'Iko Uwais, ', 'Chelsea Islan, ', 'Sunny Pang, ', 'Very Tri Yulisman']","14,960",Indonesia,s5443,"Timo Tjahjanto, Kimo Stamboel",Movie
Holiday in the Wild,(2019),TV-PG,85 min,"Comedy, Drama, Romance",6.1,"Jilted by her husband on the eve of embarking on an African safari, a woman travels to the continent alone where she meets an elephant conservationist.","['Ernie Barbarash', '| ', '    Stars:', 'Rob Lowe, ', 'Kristin Davis, ', 'Fezile Mpela, ', 'John Owen Lowe']","15,348",United States,s3338,Ernie Barbarash,Movie
Saving Zoë,(2019),R,95 min,"Crime, Drama, Mystery",5.3,"The high school freshman kid sister of the murdered Zoë finds her diary, which sheds new light on the murder missed by the police. She investigates.","['Jeffrey G. Hunt', '| ', '    Stars:', 'Laura Marano, ', 'Vanessa Marano, ', 'Chris Tavarez, ', 'Giorgia Whigham']","2,090",United States,s7951,Jeffrey G. Hunt,Movie
The Hurricane Heist,(2018),PG-13,103 min,"Action, Adventure, Crime",5.1,Thieves attempt a massive heist against the U.S. Treasury as a Category 5 hurricane approaches one of its Mint facilities.,"['Rob Cohen', '| ', '    Stars:', 'Toby Kebbell, ', 'Maggie Grace, ', 'Ryan Kwanten, ', 'Ralph Ineson']","20,847","United Kingdom, United States",s8355,Rob Cohen,Movie
A Christmas Prince,(2017),TV-PG,92 min,"Comedy, Family, Romance",5.8,"When a reporter goes undercover as a tutor to get the inside scoop on a playboy prince, she gets tangled in some royal intrigue and ends up finding love - but will she be able to keep up her lie?","['Alex Zamm', '| ', '    Stars:', 'Rose McIver, ', 'Ben Lamb, ', 'Alice Krige, ', 'Honor Kneafsey']","19,687",United States,s5164,Alex Zamm,Movie
The Hard Way,(2019),Not Rated,92 min,"Action, Thriller",4.8,"After learning his brother died on a mission in Romania, a former soldier teams up with two allies to hunt down a mysterious enemy and exact revenge.","['Keoni Waxman', '| ', '    Stars:', 'Michael Jai White, ', 'Luke Goss, ', 'Randy Couture, ', 'Madalina Anea']","3,328",United States,s4046,Keoni Waxman,Movie
Unbreakable Kimmy Schmidt: Kimmy vs the Reverend,(2020 TV Movie),TV-14,80 min,"Adventure, Comedy, Mystery",6.9,"Kimmy sets off on her biggest adventure yet. Three states. Explosions. A dancing hamburger. And you, the viewer, get to decide how the story goes.","['Claire Scanlon', '| ', '    Stars:', 'Ellie Kemper, ', 'Tituss Burgess, ', 'Carol Kane, ', 'Jane Krakowski']","5,514",United States,s2544,Claire Scanlon,Movie
Pandora,(2016),Not Rated,136 min,"Action, Drama, Thriller",6.6,The explosion of a nuclear power plant caused by an earthquake leads to a disaster which no one other than its workers can stop from spreading further.,"['Jeong-woo Park, ', 'Jong-woo Park', '| ', '    Stars:', 'Daekyum Ahn, ', 'Do-bin Baek, ', 'Seung-Hoon Choi, ', 'Sung-Wook Eo']","7,572",South Korea,s5569,Jung-woo Park,Movie
Catfight,(I) (2016),Not Rated,95 min,"Action, Comedy, Drama",5.9,The rivalry between two former college friends comes to a head when they both attend the same glamorous event.,"['Onur Tukel', '| ', '    Stars:', 'Sandra Oh, ', 'Anne Heche, ', 'Alicia Silverstone, ', 'Amy Hill']","6,477",United States,s5450,Onur Tukel,Movie
When Angels Sleep,(2018),TV-MA,91 min,"Adventure, Drama, Horror",5.5,A CEO lives the worst night of his life after he accidentally runs over a teenage girl.,"['Gonzalo Bendala', '| ', '    Stars:', 'Julián Villagrán, ', 'Marian Álvarez, ', 'Ester Expósito, ', 'Sira Alonso']","3,731",Spain,s4260,Gonzalo Bendala,Movie
Copenhagen,(2014),Not Rated,98 min,"Adventure, Drama, Romance",7.0,"When the girl of your dreams is half your age, it's time to grow up.","['Mark Raso', '| ', '    Stars:', 'Gethin Anthony, ', 'Frederikke Dahl Hansen, ', 'Sebastian Armesto, ', 'Olivia Grant']","13,318","Canada, United States, Denmark",s744,Mark Raso,Movie
Pets United,(2019),TV-Y7,89 min,"Animation, Adventure, Comedy",3.7,"A group of spoilt, selfish pets led by glamour cat Belle are stranded in their luxury hangout 'Pampered Pets,' when the machines that run Robo City, the hypermodern metropolis that they live in, go wild and take over.","['Reinhard Klooss', '| ', '    Stars:', 'Patrick Roche, ', 'Natalie Dormer, ', 'Felix Auer, ', 'Jeff Burrell']","2,803","Germany, China, United Kingdom",s2012,Reinhard Klooss,Movie
The Body,(II) (2019),TV-14,101 min,"Mystery, Thriller",5.4,"When the body of a powerful businesswoman disappears from the morgue, the inspector in charge hunts for the truth. But when he questions her husband he realizes that there is much more to the case than meets the eye.","['Jeethu Joseph', '| ', '    Stars:', 'Emraan Hashmi, ', 'Rishi Kapoor, ', 'Sobhita Dhulipala, ', 'Vedhika']","3,498",India,s2897,Jeethu Joseph,Movie
The Skin of the Wolf,(2017),TV-14,110 min,Drama,5.8,A highlander that lives alone in the mountains buys a wife to relieve his loneliness.,"['Samu Fuentes', '| ', '    Stars:', 'Mario Casas, ', 'Irene Escolar, ', 'Ruth Díaz, ', 'Kandido Uranga']","3,155",Spain,s4784,Samu Fuentes,Movie
Ravenous,(2017),TV-MA,104 min,"Action, Adventure, Drama",5.8,"In a small, remote village in northern Quebec, things have changed. Locals are not the same anymore - their bodies are breaking down and they have turned against their loved ones. A handful of survivors goes hiding in the woods, looking for others like them.","['Robin Aubert', '| ', '    Stars:', 'Marc-André Grondin, ', 'Monia Chokri, ', 'Charlotte St-Martin, ', 'Micheline Lanctôt']","9,349",Canada,s5004,Robin Aubert,Movie
True Memoirs of an International Assassin,(2016),TV-14,98 min,"Action, Comedy, Crime",5.9,"After a publisher changes a writer's debut novel about a deadly assassin from fiction to non-fiction, the author finds himself thrust into the world of his lead character, and must take on the role of his character for his own survival.","['Jeff Wadlow', '| ', '    Stars:', 'Kevin James, ', 'Kim Coates, ', 'Maurice Compte, ', 'Zulay Henao']","23,068",United States,s5720,Jeff Wadlow,Movie
After Porn Ends 3,(2018),TV-MA,86 min,Documentary,5.4,After Porn Ends 3 continues to explore whether a career as an adult performer is inherently damaging to the balance of a performer's life once retired.,"['Brittany Andrews', '| ', '    Stars:', 'Christy Canyon, ', 'Jenteal, ', 'Tera Patrick, ', 'Priya Rai']","1,656",United States,s6097,Brittany Andrews,Movie
